{
  "schemaVersion": "1.0",
  "environment": "demo",
  "origins": {
    "web": "https://cp.demo.waooaw.com",
    "api": "https://api.demo.waooaw.com",
    "identity": "https://auth.demo.waooaw.com"
  },
  "keycloak": {
    "issuer": "https://auth.demo.waooaw.com/realms/waooaw",
    "audience": "waooaw-platform",
    "jwksUri": "https://auth.demo.waooaw.com/realms/waooaw/protocol/openid-connect/certs",
    "realm": "waooaw",
    "accessTokenMinutes": 15,
    "refreshSessionHours": 8,
    "clockSkewSeconds": 30
  },
  "clients": [
    {
      "id": "waooaw-web",
      "channel": "WEB",
      "pkceRequired": true,
      "redirectUris": [
        "https://cp.demo.waooaw.com/api/auth/callback/keycloak",
        "https://cp.demo.waooaw.com/api/auth/callback/keycloak-google",
        "https://cp.demo.waooaw.com/api/auth/callback/keycloak-facebook"
      ],
      "postLogoutRedirectUris": ["https://cp.demo.waooaw.com/login"],
      "allowedOrigins": ["https://cp.demo.waooaw.com"],
      "scopes": ["openid", "profile", "email"]
    },
    {
      "id": "waooaw-mobile-demo",
      "channel": "MOBILE",
      "pkceRequired": true,
      "redirectUris": ["https://mobile.demo.waooaw.com/oidc/callback"],
      "postLogoutRedirectUris": ["https://mobile.demo.waooaw.com/logout"],
      "allowedOrigins": [],
      "scopes": ["openid", "profile", "email"]
    }
  ],
  "channels": { "web": true, "mobile": false, "whatsApp": true },
  "cookie": { "name": "waooaw.demo.session", "secure": true, "sameSite": "Lax" },
  "identityEdge": {
    "image": "nginxinc/nginx-unprivileged@sha256:62a904036bfc0e4a4f2b556e34cbf17bc136b47fde8cdb4628762725f48c5782",
    "routePolicy": "infrastructure/terraform/phase2/modules/workload/identity-edge.conf.tftpl"
  },
  "phoneIdentity": { "internalAudience": "waooaw-phone-identity-demo" },
  "providers": [
    { "id": "GOOGLE", "displayName": "Google", "authenticationPath": "GOOGLE", "enabled": true, "secretReference": "kv://kv-waooaw-demo/secrets/bp-identity-reader-client-secret", "readinessEvidenceReference": "WC-088-DEMO-GOOGLE-ACTIVATION-AUTHORIZED-2026-09-10", "brokerAlias": "google", "scopes": ["openid", "profile", "email"] },
    { "id": "FACEBOOK", "displayName": "Facebook", "authenticationPath": "META", "enabled": true, "secretReference": "kv://kv-waooaw-demo/secrets/meta-login-client-secret", "readinessEvidenceReference": "WC-090-DEMO-FACEBOOK-ACTIVATION-AUTHORIZED-2026-09-10", "brokerAlias": "facebook", "scopes": ["email", "public_profile"] },
    { "id": "APPLE", "displayName": "Apple", "authenticationPath": "APPLE", "enabled": false, "unavailableReason": "NOT_CONFIGURED", "brokerAlias": "apple", "scopes": ["openid", "name", "email"] },
    { "id": "EMAIL", "displayName": "Email", "authenticationPath": "CREDENTIAL", "enabled": false, "unavailableReason": "NOT_CONFIGURED", "scopes": [] }
  ]
}
